{
  "id": "peach-garden-oath",
  "title_zh": "桃园三结义",
  "title_en": "The Oath of the Peach Garden",
  "level": 1,
  "age_range": "5-8",
  "source_note": "Based on public-domain 《三国演义》, rewritten for children.",
  "source_url": "https://zh.wikisource.org/wiki/三國演義/第001回",
  "cover_image": "stories/peach-garden-oath/cover.png",
  "paragraphs": [
    {
      "text": "很久以前，涿县贴出榜文，盼望有人一起保护乡里。刘备读完榜文，心里想着百姓过安稳日子，不由得长叹。他明白，一个人的力量有限，若能找到志同道合的朋友，就能多做一点好事。",
      "pinyin": "hěn jiǔ yǐ qián， zhuō xiàn tiē chū bǎng wén， pàn wàng yǒu rén yì qǐ bǎo hù xiāng lǐ。 liú bèi dú wán bǎng wén， xīn lǐ xiǎng zhe bǎi xìng guò ān wěn rì zi， bù yóu de cháng tàn。 tā míng bái， yí gè rén de lì liàng yǒu xiàn， ruò néng zhǎo dào zhì tóng dào hé de péng yǒu， jiù néng duō zuò yì diǎn hǎo shì。"
    },
    {
      "text": "张飞听见叹声，走来问原因。刘备说自己力量小，却想做有益的事。张飞很赞成，愿意拿出家中积蓄，招呼乡勇。他说，家里有粮有地方，可以先让愿意帮忙的人聚在一起。",
      "pinyin": "zhāng fēi tīng jiàn tàn shēng， zǒu lái wèn yuán yīn。 liú bèi shuō zì jǐ lì liàng xiǎo， què xiǎng zuò yǒu yì de shì。 zhāng fēi hěn zàn chéng， yuàn yì ná chū jiā zhōng jī xù， zhāo hū xiāng yǒng。 tā shuō， jiā lǐ yǒu liáng yǒu dì fāng， kě yǐ xiān ràng yuàn yì bāng máng de rén jù zài yì qǐ。"
    },
    {
      "text": "这时关羽也来到店里。他听见二人的心愿，觉得他们正直可靠，便坐下一起商量。三个人越谈越投合，都想扶危助困。关羽说，做大事先要守信用，也要懂得照顾弱小的人。",
      "pinyin": "zhè shí guān yǔ yě lái dào diàn lǐ。 tā tīng jiàn èr rén de xīn yuàn， jué de tā men zhèng zhí kě kào， biàn zuò xià yì qǐ shāng liáng。 sān gè rén yuè tán yuè tóu hé， dōu xiǎng fú wēi zhù kùn。 guān yǔ shuō， zuò dà shì xiān yào shǒu xìn yòng， yě yào dǒng de zhào gù ruò xiǎo de rén。"
    },
    {
      "text": "张飞家后有一片桃园，桃花开得正好。第二天，他们在桃树下结为兄弟，约定同心协力，互相提醒，先想着百姓。桃花落在衣袖上，像给这个约定盖上温柔的印记。",
      "pinyin": "zhāng fēi jiā hòu yǒu yī piàn táo yuán， táo huā kāi dé zhèng hǎo。 dì èr tiān， tā men zài táo shù xià jié wéi xiōng dì， yuē dìng tóng xīn xié lì， hù xiāng tí xǐng， xiān xiǎng zhe bǎi xìng。 táo huā luò zài yī xiù shàng， xiàng gěi zhè ge yuē dìng gài shàng wēn róu de yìn jì。"
    },
    {
      "text": "从此，刘备、关羽、张飞一起练习、准备、照看乡亲。遇到有人搬东西，他们去帮忙；听见老人担心，他们耐心安慰。桃园里的誓言像春风一样，告诉大家：真正的勇气，是和朋友一起守护善良。",
      "pinyin": "cóng cǐ， liú bèi、 guān yǔ、 zhāng fēi yì qǐ liàn xí、 zhǔn bèi、 zhào kàn xiāng qīn。 yù dào yǒu rén bān dōng xī， tā men qù bāng máng； tīng jiàn lǎo rén dān xīn， tā men nài xīn ān wèi。 táo yuán lǐ de shì yán xiàng chūn fēng yī yàng， gào sù dà jiā： zhēn zhèng de yǒng qì， shì hé péng yǒu yì qǐ shǒu hù shàn liáng。"
    }
  ],
  "vocab": [
    {
      "word": "榜文",
      "pinyin": "bǎng wén",
      "meaning": "public notice",
      "example": "涿县贴出榜文。"
    },
    {
      "word": "乡里",
      "pinyin": "xiāng lǐ",
      "meaning": "hometown area",
      "example": "大家一起保护乡里。"
    },
    {
      "word": "积蓄",
      "pinyin": "jī xù",
      "meaning": "savings",
      "example": "张飞愿意拿出积蓄。"
    },
    {
      "word": "结为兄弟",
      "pinyin": "jié wéi xiōng dì",
      "meaning": "to become sworn brothers",
      "example": "他们在桃树下结为兄弟。"
    },
    {
      "word": "同心协力",
      "pinyin": "tóng xīn xié lì",
      "meaning": "to work together with one heart",
      "example": "他们约定同心协力。"
    },
    {
      "word": "乡亲",
      "pinyin": "xiāng qīn",
      "meaning": "neighbors from the same village",
      "example": "他们照看乡亲。"
    }
  ],
  "questions": [
    {
      "id": "q1",
      "type": "single_choice",
      "prompt": "刘备看到榜文后最想做什么？",
      "options": [
        "保护乡里",
        "去摘桃子",
        "独自旅行"
      ],
      "answer": "保护乡里",
      "explanation": "正文说刘备想着让百姓过安稳日子。"
    },
    {
      "id": "q2",
      "type": "single_choice",
      "prompt": "三个人在哪里结为兄弟？",
      "options": [
        "桃园",
        "江边",
        "城楼"
      ],
      "answer": "桃园",
      "explanation": "张飞家后有桃园，他们在桃树下结为兄弟。"
    },
    {
      "id": "q3",
      "type": "single_choice",
      "prompt": "这个故事最想告诉我们什么？",
      "options": [
        "朋友齐心能守护善良",
        "遇事只靠一个人",
        "不要听别人说话"
      ],
      "answer": "朋友齐心能守护善良",
      "explanation": "三人约定同心协力，互相提醒，照看乡亲。"
    }
  ],
  "retell_prompt": "说说刘备、关羽、张飞为什么愿意结为兄弟。"
}
