{
  "id": "three-visits-cottage",
  "title_zh": "三顾茅庐",
  "title_en": "Three Visits to the Thatched Cottage",
  "level": 1,
  "age_range": "5-8",
  "source_note": "Based on public-domain 《三国演义》, rewritten for children.",
  "source_url": "https://zh.wikisource.org/wiki/三國演義/第037回",
  "cover_image": "stories/three-visits-cottage/cover.png",
  "paragraphs": [
    {
      "text": "刘备听说隆中有位诸葛亮，读书多，主意好，心里十分敬佩。他想请诸葛亮一起帮助百姓，便带着关羽、张飞去拜访。山路弯弯，草木安静，刘备一路上都在想怎样把来意说清楚。",
      "pinyin": "liú bèi tīng shuō lóng zhōng yǒu wèi zhū gě liàng， dú shū duō， zhǔ yì hǎo， xīn lǐ shí fēn jìng pèi。 tā xiǎng qǐng zhū gě liàng yì qǐ bāng zhù bǎi xìng， biàn dài zhe guān yǔ、 zhāng fēi qù bài fǎng。 shān lù wān wān， cǎo mù ān jìng， liú bèi yī lù shàng dōu zài xiǎng zěn yàng bǎ lái yì shuō qīng chǔ。"
    },
    {
      "text": "第一次到茅庐，诸葛亮不在家。刘备没有生气，只留下问候。第二次再去，还是没有见到。张飞有些着急，刘备却说，请教贤人要有耐心。关羽也点点头，提醒大家说话要轻，脚步要稳。",
      "pinyin": "dì yī cì dào máo lú， zhū gě liàng bù zài jiā。 liú bèi méi yǒu shēng qì， zhǐ liú xià wèn hòu。 dì èr cì zài qù， hái shì méi yǒu jiàn dào。 zhāng fēi yǒu xiē zháo jí， liú bèi què shuō， qǐng jiào xián rén yào yǒu nài xīn。 guān yǔ yě diǎn diǎn tóu， tí xǐng dà jiā shuō huà yào qīng， jiǎo bù yào wěn。"
    },
    {
      "text": "第三次，三人又来到茅庐。刘备先在门外等候，怕打扰主人休息。等诸葛亮醒来，他才恭恭敬敬地说明来意。他没有催促，也没有摆架子，只把心里的愿望认真讲出来。",
      "pinyin": "dì sān cì， sān rén yòu lái dào máo lú。 liú bèi xiān zài mén wài děng hòu， pà dǎ rǎo zhǔ rén xiū xī。 děng zhū gě liàng xǐng lái， tā cái gōng gōng jìng jìng dì shuō míng lái yì。 tā méi yǒu cuī cù， yě méi yǒu bǎi jià zi， zhǐ bǎ xīn lǐ de yuàn wàng rèn zhēn jiǎng chū lái。"
    },
    {
      "text": "诸葛亮看见刘备这样尊重别人，也愿意认真交谈。他们谈到天下百姓，谈到怎样让更多人过安稳日子，越谈越投合。屋外风吹竹叶，屋里的人却越说越明白。",
      "pinyin": "zhū gě liàng kàn jiàn liú bèi zhè yàng zūn zhòng bié rén， yě yuàn yì rèn zhēn jiāo tán。 tā men tán dào tiān xià bǎi xìng， tán dào zěn yàng ràng gèng duō rén guò ān wěn rì zi， yuè tán yuè tóu hé。 wū wài fēng chuī zhú yè， wū lǐ de rén què yuè shuō yuè míng bái。"
    },
    {
      "text": "后来，诸葛亮决定帮助刘备。三顾茅庐的故事告诉我们，真诚不是一句话，而是一次又一次有礼貌地坚持。想请别人帮助时，先学会尊重别人，也学会把目标说得清清楚楚。",
      "pinyin": "hòu lái， zhū gě liàng jué dìng bāng zhù liú bèi。 sān gù máo lú de gù shì gào sù wǒ men， zhēn chéng bú shì yī jù huà， ér shì yī cì yòu yī cì yǒu lǐ mào dì jiān chí。 xiǎng qǐng bié rén bāng zhù shí， xiān xué huì zūn zhòng bié rén， yě xué huì bǎ mù biāo shuō dé qīng qīng chǔ chǔ。"
    }
  ],
  "vocab": [
    {
      "word": "隆中",
      "pinyin": "lóng zhōng",
      "meaning": "Longzhong, a place name",
      "example": "刘备听说隆中有位诸葛亮。"
    },
    {
      "word": "茅庐",
      "pinyin": "máo lú",
      "meaning": "thatched cottage",
      "example": "第一次到茅庐。"
    },
    {
      "word": "拜访",
      "pinyin": "bài fǎng",
      "meaning": "to visit respectfully",
      "example": "刘备去拜访诸葛亮。"
    },
    {
      "word": "耐心",
      "pinyin": "nài xīn",
      "meaning": "patience",
      "example": "请教贤人要有耐心。"
    },
    {
      "word": "尊重",
      "pinyin": "zūn zhòng",
      "meaning": "respect",
      "example": "诸葛亮看见刘备尊重别人。"
    },
    {
      "word": "真诚",
      "pinyin": "zhēn chéng",
      "meaning": "sincerity",
      "example": "真诚需要有礼貌地坚持。"
    }
  ],
  "questions": [
    {
      "id": "q1",
      "type": "single_choice",
      "prompt": "刘备为什么去拜访诸葛亮？",
      "options": [
        "想请他帮助百姓",
        "想买草鞋",
        "想找桃花"
      ],
      "answer": "想请他帮助百姓",
      "explanation": "正文说刘备想请诸葛亮一起帮助百姓。"
    },
    {
      "id": "q2",
      "type": "single_choice",
      "prompt": "前两次没见到诸葛亮，刘备怎样做？",
      "options": [
        "继续有耐心",
        "立刻发火",
        "再也不来"
      ],
      "answer": "继续有耐心",
      "explanation": "刘备说请教贤人要有耐心。"
    },
    {
      "id": "q3",
      "type": "single_choice",
      "prompt": "三顾茅庐最能表现刘备的什么品质？",
      "options": [
        "真诚和尊重",
        "骄傲和粗心",
        "害怕和懒惰"
      ],
      "answer": "真诚和尊重",
      "explanation": "刘备多次拜访，并在门外等候，表现真诚和尊重。"
    }
  ],
  "retell_prompt": "说说刘备三次拜访诸葛亮时怎样表现出真诚。"
}
